id,name
4682,"Val Verde County Clerk, Val Verde County, TX"
4683,"University of South Carolina, South Carolina"
4684,"Department of Justice, Community Oriented Policing Services (COPS), United States of America"
4687,"Federal Bureau of Investigation - FBI, CIA, Department of Homeland Security, Office of the Director of National Intelligence (ODNI), United States of America"
4688,"Clemson University, Engineering and Science, South Carolina"
4690,"College of William and Mary, Virginia"
4692,"University of Colorado Denver, Colorado"
4693,"University of Utah, Utah"
4694,"University of Tennessee, Knoxville, Tennessee"
4695,"Sonoma County Sheriff's Office, Sonoma County, CA"
4697,"National Credit Union Administration, United States of America"
4698,"Department of Corrections, Office of the Inspector General, Florida"
4701,"Santa Rosa Police Department, Santa Rosa, CA"
4702,"Placer Unified High School District, Placer County, CA"
4703,"Department of Industrial Accidents, Massachusetts"
4706,"Florida Department of State, Florida"
4707,"Topeka Police Department, Topeka, KS"
4708,"Colorado General Assembly, Colorado"
4713,"US Department of State - Bureau of Consular Affairs, United States of America"
4714,"Department of Safety & Permits, New Orleans, LA"
4715,"Office of the Director of Finance, Philadelphia, PA"
4716,"Salt Lake County District Attorney's Office, Salt Lake County, UT"
4718,"Fair Political Practices Commission, California"
4719,"U.S. Department of the Treasury, Office of Intelligence and Analysis, Office of Security Programs, United States of America"
4720,"National Counterintelligence and Security Center, United States of America"
4721,"Department of Budget and Finance, Lawrence, MA"
4724,"NASA - Office of the Inspector General, United States of America"
4726,"Department of Health, Virginia"
4727,"New Mexico Department of Public Safety, New Mexico"
4729,"Citrus County Building Division, Citrus County, FL"
4730,"Secretary of State (CO), Colorado"
4731,"US Army Corps of Engineers - Sacramento Division, United States of America"
4734,"Administrative Office of Courts (AL), Alabama"
4735,"Department of State, Office of the Inspector General, United States of America"
4736,"Bexar County Auditor's Office, Bexar County, TX"
4737,"Oakland County Sheriff's Office, Oakland County, MI"
4738,"Beaver Dam Police Department, Beaver Dam, WI"
4739,"Duluth Public School District, Duluth, MN"
4740,"University of Minnesota Duluth, Duluth, MN"
4741,"Taxi and Limousine Commission, New York City, NY"
4742,"Department of Industrial Relations, Division of Occupational Safety and Health, California"
4744,"Seminole County Fire Department, Seminole County, FL"
4745,"Office of the City Clerk, Chula Vista, CA"
4746,"Office of the City Clerk, Anaheim, CA"
4747,"Office of the City Clerk, Covina, CA"
4748,"Administrative Office of the Courts, New Hampshire"
4749,"City Clerk Department, Moreno Valley, CA"
4750,"City Clerk, La Habra Heights, CA"
4751,"Office of the City Clerk, West Covina, CA"
4752,"City Clerk, Glendora, CA"
4753,"City Manager's Office, Long Beach, CA"
4754,"City Clerk's Department, Rialto, CA"
4755,"City Clerk, Ontario, CA"
4756,"Chief Administrative Office, San Diego County, CA"
4757,"City Clerk, San Marcos, CA"
4758,"City Clerk, Calexico, CA"
4759,"Redevelopment Agency, Fontana, CA"
4760,"City Clerk, Fontana, CA"
4761,"City Clerk, Menifee, CA"
4762,"City Clerk, Indio, CA"
4763,"City Clerk, Murrieta, CA"
4764,"City Clerk, Rosemead, CA"
4765,"Federal Prison Industries - UNICOR, United States of America"
4767,"Berkshire County Jail and House of Correction, Berkshire County, MA"
4768,"Bristol County House of Correction and Jail, Bristol County, MA"
4769,"Bristol County Sheriff's Office, Bristol County, MA"
4770,"Bristol County Sheriff's Office Women's Center, Bristol County, MA"
4771,"C. Carlos Carreiro Immigration Detention Center, Bristol County, MA"
4772,"Ash Street Jail and Regional Lock-Up, Bristol County, MA"
4773,"Dukes County Sheriff, Dukes County, MA"
4774,"Committee for Public Council Services, Massachusetts"
4775,"Kentucky Department of Transportation, Kentucky"
4776,"Pflugerville Independent School District Police, Pflugerville, TX"
4777,"Borough of Sayreville, Sayreville, NJ"
4780,"Illinois Attorney General, Illinois"
4781,"Fairfax County Government Department of Information Technology, Fairfax County, VA"
4782,"Virginia Department  of Forensic Science, Virginia"
4783,"Cumberland County Sheriff's Office, Cumberland County, NJ"
4784,"Office of Attorney General, Texas"
4785,"City of Sanford City Clerk, Sanford, FL"
4786,"Armed Forces Health Surveillance Center, United States of America"
4788,"Governor's Office, Pennsylvania"
4789,"Office of the Governor, North Carolina"
4790,"Office of the Governor, Michigan"
4791,"Office of the Governor, Virginia"
4792,"Office of the Governor, Indiana"
4793,"Office of the Governor, Tennessee"
4794,"Office of the Governor, Maryland"
4796,"Office of the Governor, Arkansas"
4797,"Yamhill County Sheriff's Office, Yamhill County, OR"
4798,"Athens Police Department, Athens, TN"
4799,"Eufaula Police Department, Canadian, OK"
4800,"Metropolitan Area Planning Council, Massachusetts"
4801,"Michigan Department of Attorney General, Michigan"
4802,"Eufaula Police Department, Pittsburg County, OK"
4803,"Eufaula Police Department, Eufaula, OK"
4804,"McAlester Police Department, Mcalester, OK"
4805,"Pittsburg County Sheriff's Office, Pittsburg County, OK"
4806,"McIntosh County Sheriff's Office, Mcintosh County, OK"
4809,"Office of the Governor, Connecticut"
4810,"Office of the Governor, Delaware"
4811,"Office of the Governor - Idaho, Idaho"
4812,"Office of the Governor - Iowa, Iowa"
4813,"Office of the Governor - Maine, Maine"
4814,"Office of the Governor - Nebraska, Nebraska"
4815,"Office of the Governor - New Hampshire, New Hampshire"
4816,"Office of the Governor - North Dakota, North Dakota"
4817,"Office of the Governor - Oregon, Oregon"
4818,"Office of the Governor - South Carolina, South Carolina"
4819,"Office of the Governor - South Dakota, South Dakota"
4820,"Office of the Governor - Vermont, Vermont"
4821,"Office of the Governor - Wisconsin, Wisconsin"
4822,"Office of the Governor - Wyoming, Wyoming"
4823,"Office of the Attorney General, Alabama"
4824,"Palm Springs Police Department, Palm Springs, CA"
4826,"Boston Public Health Commission, Boston, MA"
4827,"Office of the Attorney General, Alaska"
4828,"Office of the Attorney General, Arizona"
4829,"Office of the Attorney General, Arkansas"
4830,"Office of the Attorney General - Colorado, Colorado"
4831,"Colorado State Archives, Colorado"
4832,"Southborough Police Department, Southborough, MA"
4834,"Public Utilities Commission, San Francisco, CA"
4835,"Department of Public Works, San Francisco, CA"
4836,"Department of Public Health, San Francisco, CA"
4837,"Public Health Department, San Francisco, CA"
4838,"San Francisco Supervisor London Breed, San Francisco, CA"
4839,"City of New Castle, New Castle, DE"
4840,"Public Employee Relations Board, Delaware"
4841,"Hanscom Air Force Base, United States of America"
4842,"Wallingford Board of Education, Wallingford, CT"
4843,"Department of Technology and Information, Delaware"
4844,"Palatine Police Department, Palatine, IL"
4845,"Louisiana State University Law Center, Louisiana"
4846,"U.S. Army Research Laboratory, United States of America"
4847,"U.S. Navy - Region Legal Service Office South West, United States of America"
4848,"The Pentagon, United States of America"
4850,"Office of the Attorney General - Connecticut, Connecticut"
4851,"Office of the Attorney General - Delaware, Delaware"
4852,"Office of the Attorney General - Florida, Florida"
4853,"Office of the Attorney General - Georgia, Georgia"
4854,"Office of the Attorney General - Hawaii, Hawaii"
4855,"Office of the Attorney General - Idaho, Idaho"
4856,"Office of the Attorney General - Indiana, Indiana"
4857,"Office of the Attorney General - Iowa, Iowa"
4858,"Office of the Attorney General - Kansas, Kansas"
4859,"Office of the Attorney General - Kentucky, Kentucky"
4860,"Office of the Attorney General - Louisiana, Louisiana"
4861,"Office of the Attorney General - Maine, Maine"
4862,"Office of the Attorney General - Minnesota, Minnesota"
4863,"Office of the Attorney General - Missouri, Missouri"
4864,"Office of the Attorney General - Nebraska, Nebraska"
4865,"Office of the Attorney General - Nevada, Nevada"
4866,"Office of the Attorney General - New Hampshire, New Hampshire"
4867,"Department of Human Resources, Alabama"
4868,"Office of the Attorney General - New Mexico, New Mexico"
4869,"Office of the Attorney General - North Carolina, North Carolina"
4870,"Office of the Attorney General - North Dakota, North Dakota"
4871,"Office of the Attorney General - Ohio, Ohio"
4872,"Sheriff, Clallam County, WA"
4873,"City of McFarland, Mcfarland, CA"
4874,"Blair County, Blair, PA"
4875,"Quincy Inspectional Services, Quincy, MA"
4876,"Duluth Police Department, Duluth, MN"
4877,"Washington State Department of Transportation - Ferries, Washington"
4878,"Department of Justice, Delaware"
4879,"City of Delaware City, Delaware City, DE"
4881,"Massachusetts Turnpike Authority, Massachusetts"
4882,"Alcoholic Beverage Control, Virginia"
4883,"Department of Agriculture,  Natural Resources Conservation Service, United States of America"
4884,"Manhattan District Attorney's Office, New York City, NY"
4887,"Virginia State Bar, Virginia"
4889,"California State University, Fullerton - University Police, California"
4890,"Hacienda La Puente Unified School District - Police, La Puente, CA"
4891,"Los Angeles County Sheriff's Department - Industry Station, Industry, CA"
4892,"Mt. San Antonio College District - Public Safety Police, Walnut, CA"
4893,"Department of Defense, United States of America"
4894,"Binghamton Police Department, Binghamton, NY"
4895,"Binghamton Office of the Mayor, Binghamton, NY"
4896,"Binghamton City School District, Binghamton, NY"
4897,"Buffalo Police Department, Buffalo, NY"
4898,"Buffalo City School District, Buffalo, NY"
4899,"Buffalo Mayor's Office, Buffalo, NY"
4900,"Rainsville City Hall, Rainsville, AL"
4901,"Longview Police Department, Longview, TX"
4903,"New Castle County Police Department, New Castle County, DE"
4905,"Vineland Police Department, Cumberland County, NJ"
4906,"Millville Police Department, Cumberland County, NJ"
4908,"City of Bridgeton, Bridgeton, NJ"
4910,"Office of the Attorney General - Oklahoma, Oklahoma"
4911,"Office of the Attorney General - Oregon, Oregon"
4912,"Office of the Attorney General - Pennsylvania, Pennsylvania"
4913,"Office of the Attorney General - South Carolina, South Carolina"
4914,"Office of the Attorney General - South Dakota, South Dakota"
4916,"Office of the Attorney General - Utah, Utah"
4917,"Office of the Attorney General - Washington, Washington"
4918,"Office of the Attorney General - West Virginia, West Virginia"
4919,"Office of the Attorney General - Wyoming, Wyoming"
4920,"Department of Health and Social Services, Alaska"
4921,"Health and Human Services Agency - California, California"
4922,"Department of Human Services, Colorado"
4923,"Department of Social Services, Connecticut"
4924,"Department of Health and Social Services, Delaware"
4925,"Department of Human Services, Georgia"
4926,"Department of Human Services, Hawaii"
4927,"City of Winnfield Police Department, Winnfield, LA"
4930,"Kinder Police Department, Kinder, LA"
4931,"State University of New York Rockland Community College, New York"
4932,"University of Delaware, Delaware"
4934,"City of Newark, Newark, DE"
4936,"University of Arkansas Libraries, Arkansas"
4938,"Hot Springs Police Department, Hot Springs, AR"
4940,"Calexico Police Department, Calexico, CA"
4941,"FDA  Federal Food and Drug administration, United States of America"
4943,"Biddeford Police Department, Biddeford, ME"
4945,"Department of Homeland Security, Office for Civil Rights and Civil Liberties, United States of America"
4946,"Delaware State University, Delaware"
4948,"Financial Services, Somerset County, NJ"
4949,"Fulton County Police Department, Fulton County, GA"
4950,"U.S. Senate Disbursing Office, United States of America"
4951,"City of Adelanto, Adelanto, CA"
4952,"LaSalle Economic Development District, Jena, LA"
4953,"Town of Jena, Jena, LA"
4954,"City of Alexandria, Alexandria, LA"
4955,"Alexandria Police Department, Alexandria, LA"
4956,"Vineland Police Department, Vineland, NJ"
4957,"Erie County District Attorney's Office, Erie County, NY"
4959,"St. Petersburg Police Department, Pinellas County, FL"
4960,"Iowa City School District, Iowa City, IA"
4961,"Defense Media Activity, United States of America"
4962,"Dennis Carlone, Cambridge City Council, Cambridge, MA"
4963,"Cambridge City Council, Cambridge, MA"
4966,"Cleveland Municipal Court Criminal Traffic Division, Cuyahoga County, OH"
4970,"Department of Veterans Affairs, Office of Inspector General, United States of America"
4971,"United States Attorney's Office, Western District of New York, United States of America"
4972,"Department of Revenue, Colorado"
4973,"Department of Revenue, Alaska"
4975,"Cuyahoga County Sheriff, Cuyahoga County, OH"
4976,"Black out Collective, Oakland, CA"
4977,"Kansas Bureau of Investigation, Kansas"
4981,"National Marine Fisheries Service, United States of America"
4983,"Waterloo School District, Waterloo, IA"
4984,"Lincoln County Sheriff's Department, Lincoln County, NV"
4985,"Lincoln County Emergency Management Office, Lincoln County, NV"
4986,"Clearwater Police Department, Clearwater, FL"
4987,"Federal Maritime Commission, United States of America"
4988,"Police Department, New Canaan, CT"
4990,"City of Aurora, Aurora, CO"
4991,"Baldwin Park Police Department, Baldwin Park, CA"
4992,"City of Baldwin Park, Baldwin Park, CA"
4993,"Panama City Police Department, Panama City, FL"
4994,"City of Big Spring, Big Spring, TX"
4995,"Big Spring Police Department, Big Spring, TX"
4996,"City of Milton, Milton, FL"
4997,"Milton Police Department, Milton, FL"
4998,"City of Falfurrias, Falfurrias, TX"
4999,"Falfurrias Police Department, Falfurrias, TX"
5000,"City of Pompano Beach, Pompano Beach, FL"
5002,"Office of State Employment Relations, Wisconsin"
5003,"Williamson County Clerk - Courts Division, Williamson County, TX"
5004,"U.S. Air Force - Global Strike Command, United States of America"
5005,"North Allegheny School District, Mccandless, PA"
5006,"Butler Area School District, Cranberry, PA"
5007,"Seneca Valley School District, Harmony, PA"
5008,"Anchorage Correctional Complex, Alaska"
5009,"Arizona State Prison Complex - Phoenix, Arizona"
5010,"Colorado State Penitentiary, Colorado"
5011,"Fulton County Schools Police Department, Fulton County, GA"
5014,"Department of the Navy, Office of the General Counsel, United States of America"
5015,"Maryland National Guard, United States of America"
5016,"Josephine County Sheriff's Office, Josephine County, OR"
5017,"District Attorney Office, Josephine County, OR"
5018,"Surveyor Office, Josephine County, OR"
5019,"Clerk Office, Josephine County, OR"
5022,"Abbevile Police Department, Abbeville, AL"
5023,"Police Dept., Joliet, IL"
5026,"Needham Public Schools, Needham, MA"
5027,"City of Fort Collins Police Department, Fort Collins, CO"
5028,"Bronx County District Attorney's Office, New York"
5029,"Department of Health and Welfare, Idaho"
5030,"Department of Human Services, Illinois"
5031,"Family and Social Services Administration, Indiana"
5032,"Department of Human Services, Iowa"
5033,"Department for Children and Families, Kansas"
5034,"Cabinet for Health and Family Services, Kentucky"
5035,"Department of Children and Family Services, Louisiana"
5036,"Department of Human Resources, Maryland"
5037,"Department of Human Services, Michigan"
5038,"Department of Human Services, Minnesota"
5039,"Department of Human Services, Mississippi"
5040,"Department of Social Services, Missouri"
5041,"Department of Health and Human Services, Nebraska"
5042,"Department of Health and Human  Services, Nevada"
5043,"Department of Health and Human Services, New Hampshire"
5044,"Department of Human Services, North Dakota"
5045,"Department of Jobs and Family Services, Ohio"
5046,"Houston Independent School District, Houston, TX"
5047,"Navy Expeditionary Combat Command, United States of America"
5048,"City of Santa Clara Police Department, Santa Clara, CA"
5049,"Department of Education, West Virginia"
5050,"Santa Cruz County Sheriff's Office, Santa Cruz, CA"
5051,"City of McFarland Police Department, Mcfarland, CA"
5052,"Department of Cultural Affairs, New York City, NY"
5053,"Civilian Complaint and Review Board, New York City, NY"
5055,"Garrett County Schools, Garrett County, MD"
5056,"Office of the Attorney General - Alabama, Alabama"
5057,"Office of the Attorney General - Alaska, Alaska"
5065,"Office of the Attorney General - New Jersey, New Jersey"
5068,"Office of the Attorney General - Tennessee, Tennessee"
5073,"Carmichaels Area School District, Greene County, PA"
5074,"Central Greene School District, Greene County, PA"
5075,"Southeastern Greene School District, Greene County, PA"
5076,"City of Pittsburgh, Pittsburgh, PA"
5077,"Garland Texas Police Department, Garland, TX"
5078,"Albion Department of Public Safety, Albion, MI"
5079,"Lombard Police Department, Lombard, IL"
5080,"Fairfax County Police Department, Virginia"
5081,"Fairfax County Adult Detention Center, Virginia"
5082,"Department of Social and Health services, Washington"
5083,"Fairfax County Police, Virginia"
5086,"U.S. Army - Fort Stewart - Third Infantry Division, United States of America"
5090,"Finance Department, Birmingham, AL"
5091,"Finance Department, Kansas City, MO"
5092,"Human Resources Department, Phoenix, AZ"
5093,"Texas Workforce Commission, Texas"
5094,"Human Resources Development, Hawaii"
5095,"House of Representatives, Missouri"
5096,"Walton County Sheriff's Office, Walton County, FL"
5097,"Washington State University, Washington"
5099,"Batte Creek Police Department, Battle Creek, MI"
5100,"Englewood Police Department, Englewood, NJ"
5101,"aaaa, United States of America"
5102,"Monongalia County Schools, Monongalia County, WV"
5103,"Preston County Schools, Preston County, WV"
5104,"Wetzel County Schools, Wetzel County, WV"
5105,"Hernando County Sheriff's Department, Hernando County, FL"
5106,"DNR, Duluth, MN"
5107,"Department of Education, Minnesota"
5109,"Okaloosa County Sheriff’s Office, Okaloosa County, FL"
5110,"Waco Police Department, Waco, TX"
5111,"Dallas Fusion Center, Dallas, TX"
5112,"Department of Business Affairs and Consumer Protection, Chicago, IL"
5113,"Chapel Hill Police Department, Chapel Hill, NC"
5114,"Delaware Criminal Justice Information System, Delaware"
5115,"Deparment of Defense, United States of America"
5116,"City of Wheelwright, Wheelwright, KY"
5117,"Cambria County, Cambria County, PA"
5119,"Springdale Police Department, Springdale, AR"
5121,"Police Department, Attleboro, MA"
5122,"New Bedford Police Department, New Bedford, MA"
5123,"Director, Office of Information Policy, United States of America"
5124,"Industrial Development Financing Authority, Boston, MA"
5125,"Special Committee on the 2024 Olympics, Boston, MA"
5127,"Philadelphia City School District, Philadelphia, PA"
5128,"Pittsburgh Public Schools, Pittsburgh, PA"
5129,"Central Bucks County School District, Bucks County, PA"
5130,"Reading School District, Reading, PA"
5131,"Allentown School District, Allentown, PA"
5132,"Bethlehem Area School District, Bethlehem, PA"
5133,"North Penn Area School District, Lansdale, PA"
5134,"Erie Area School District, Erie, PA"
5135,"Upper Darby Area School District, Upper Darby, PA"
5136,"West Chester Area School District, West Chester, PA"
5137,"Downingtown Area School District, Downingtown, PA"
5138,"Council Rock School District, Newtown, PA"
5139,"Lancaster Area School District, Lancaster, PA"
5140,"Central Dauphin Area School District, Harrisburg, PA"
5141,"Pennsbury Area School District, Bucks County, PA"
5142,"Hazleton Area School District, Hazleton, PA"
5143,"Pocono Mountain Area School District, Monroe County, PA"
5144,"Kanawha County School District, Kanawha County, WV"
5145,"Marion County School District, Marion County, WV"
5146,"Scranton School District, Scranton, PA"
5147,"Parkland School District, North Whitehall, PA"
5148,"Easton Area School District, Easton, PA"
5149,"Neshaminy School District, Langhorne, PA"
5150,"Chambersburg Area School District, Chambersburg, PA"
5151,"East Penn School District, Emmaus, PA"
5152,"Altoona Area School District, Altoona, PA"
5153,"Oklahoma Department of Human Services, Oklahoma"
5154,"Department of Human Services, Oregon"
5155,"Department of Human Services, Rhode Island"
5156,"Department of Human Services, Pennsylvania"
5157,"Department of Health and Human Services, South Carolina"
5158,"Department of Human Services, Utah"
5159,"Department of Education, Department of Veterans Affairs,, United States of America"
5160,"Department of Defense, Sexual Assault Prevention and Response, United States of America"
5162,"Bicycle Advisory Committee, Minneapolis, MN"
5163,"Department of Natural Resources (Minnesota), Minnesota"
5165,"Smyrna Police Department, Smyrna, DE"
5166,"Seaford Police Department, Seaford, DE"
5167,"Senatobia Police Department, Senatobia, MS"
5168,"National Nuclear Security Administration, United States of America"
5169,"San Francisco Sheriff's Department, San Francisco City and County, CA"
5170,"Pipeline and Hazardous Materials Safety Administration, United States of America"
5172,"mayor''s, Boston, MA"
5173,"Department of Social Services, California"
5174,"Department of Children and Families, Florida"
5175,"University of Nebraska, Nebraska"
5176,"Trumbull Police Department, Trumbull, CT"
5177,"FRANKLIN REGIONAL SCHOOL DISTRICT, Murrysville, PA"
5178,"SOUTHMORELAND SCHOOL DISTRICT, Westmoreland County, PA"
5179,"LIGONIER VALLEY SCHOOL DISTRICT, Ligonier, PA"
5180,"DERRY AREA SCHOOL DISTRICT, Derry, PA"
5181,"GREATER LATROBE SCHOOL DISTRICT, Latrobe, PA"
5182,"JEANNETTE CITY SCHOOL DISTRICT, Jeannette, PA"
5183,"NEW KENSINGTON-ARNOLD SCHOOL DISTRICT, New Kensington, PA"
5184,"MONESSEN CITY SCHOOL DISTRICT, Monessen, PA"
5185,"Arizona Department of Insurance, Arizona"
5186,"Connecticut Insurance Department, Connecticut"
5187,"Pennsylvania Insurance Department, Pennsylvania"
5188,"New Haven Police Department, New Haven, CT"
5190,"Cambridge Election Commission, Cambridge, MA"
5191,"Federal Transit Administration, United States of America"
5192,"Federal Railroad Administration, United States of America"
5193,"United States Postal Service, Office of Inspector General, United States of America"
5194,"New York City Economic Development Corporation, New York City, NY"
5195,"Police Department, McKinney, TX"
5196,"Animal Plant and Health Inspection Service, United States of America"
5197,"Buffalo Corporation Counsel, Buffalo, NY"
5198,"Buffalo Public Schools, Buffalo, NY"
5200,"McDuffie County Schools, McDuffie County, GA"
5201,"Robertson County Schools, Robertson County, TN"
5202,"Lincoln Parish Schools, Lincoln County, LA"
5203,"California Department of Transportation, California"
5204,"Carlsbad Police Department, Carlsbad, NM"
5205,"Chaves County Sheriff's Office, Chaves County, NM"
5206,"Eddy County Sheriff's Department, Eddy County, NM"
5207,"Hobbs Police Department, Hobbs, NM"
5208,"Lea County Sheriff's Department, Lea County, NM"
5209,"Lincoln County Sheriff's Department, Lincoln County, NM"
5210,"Pecos Valley Drug Task Force, Carlsbad, NM"
5211,"Roswell Police Department, Roswell, NM"
5212,"Roosevelt Sheriff's Department, Roosevelt County, NM"
5213,"New Port Richey Police Department, New Port Richey, FL"
5214,"Revere  city solicitor, Revere, MA"
5215,"Harlingen Police Department, Harlingen, TX"
5217,"Fresno Police Department, Fresno, CA"
5218,"Colorado Springs Police Department, Colorado Springs, CO"
5219,"Omaha Police Department, Omaha, NE"
5220,"Bakersfield Police Department, Bakersfield, CA"
5221,"Santa Ana Police Department, Santa Ana, CA"
5222,"Reno Police Department, Reno, NV"
5223,"Corpus Christi Police Department, Corpus Christi, TX"
5224,"Glendale Police Department, Glendale, AZ"
5225,"Riverside Police Department, Riverside, CA"
5226,"Durham Police Department, Durham, NC"
5227,"Anchorage Police Department, Anchorage, AK"
5228,"Irving Police Department, Irving, TX"
5229,"Stockton Police Department, Stockton, CA"
5230,"Baton Rouge Police Department, Baton Rouge-East Baton Rouge, LA"
5231,"Greensboro Police Department, Greensboro, NC"
5232,"Irvine Police Department, Irvine, CA"
5233,"Plano Police Department, Plano, TX"
5234,"Lubbock Police Department, Lubbock, TX"
5235,"Jersey City Police Department, Jersey City, NJ"
5236,"Winston-Salem Police Department, Winston-Salem, NC"
5237,"Chula Vista Police Department, Chula Vista, CA"
5238,"Laredo Police Department, Laredo, TX"
5239,"GRTC Transit System, Virginia"
5240,"Minnesota State Patrol, Minnesota"
5242,"Department of Public Safety, Utah"
5244,"Arkansas State University, Arkansas"
5245,"Norman Police Department, Norman, OK"
5247,"Kirkland Police Department, Clinton, NY"
5248,"Department of Human Resources, Honolulu, HI"
5249,"Office of Payroll Administration, New York City, NY"
5250,"Department of Administration, Arizona"
5251,"Citizens' Service Bureau, St. Louis, MO"
5252,"St. Louis Citizens' Service Bureau, St. Louis, MO"
