id,name
1,"Suffolk County Sheriff's Department, Suffolk County, MA"
2,"Traffic, Parking & Transportation, Cambridge, MA"
3,"Office of Michael P. Ross, Boston, MA"
6,"Central Intelligence Agency, United States of America"
7,"Department of Defense, Office of the Secretary of Defense, United States of America"
8,"Department of Homeland Security, Office of Intelligence & Analysis, United States of America"
9,"Department of Homeland Security, United States of America"
10,"Federal Bureau of Investigation, United States of America"
11,"Mayor's Office, Boston, MA"
12,"Executive Office for United States Attorneys, United States of America"
14,"U.S. Department of State, United States of America"
15,"Department of Energy, United States of America"
17,"National Security Agency, United States of America"
18,"Department of Transitional Assistance, Massachusetts"
19,"Department of Public Works, Somerville, MA"
20,"George Bush Presidential Library, United States of America"
21,"William J. Clinton Presidential Library, United States of America"
22,"Ronald Reagan Presidential Library, United States of America"
23,"United States Central Command - CENTCOM, United States of America"
24,"Defense Intelligence Agency, United States of America"
25,"Army - United States Department of the Army, United States of America"
26,"Office of Consumer Affairs and Business Regulation, Massachusetts"
27,"Marines - United States Marine Corps, USMC, United States of America"
28,"Cambridge Animal Commission, Cambridge, MA"
29,"Boston Assessing Department, Boston, MA"
30,"Election Department, Somerville, MA"
31,"Department of Education, Massachusetts"
32,"United States Postal Service, United States of America"
33,"General Services Administration, United States of America"
34,"Traffic and Parking, Somerville, MA"
35,"Nixon Presidential Library & Museum, United States of America"
36,"Lyndon Baines Johnson Library & Museum, United States of America"
37,"John F. Kennedy Presidential Library & Museum, United States of America"
38,"United States Customs and Border Protection, United States of America"
39,"Transportation Security Administration, United States of America"
41,"Bureau of Prisons, United States of America"
42,"Somerville Police Department, Somerville, MA"
43,"Information Technology, Somerville, MA"
44,"U.S. Department of Education, United States of America"
46,"Federal Communications Commission, United States of America"
47,"Office of Government Ethics, United States of America"
48,"Census Bureau, Data Preparation Division, United States of America"
49,"Department of Justice, United States Marshals, United States of America"
53,"Smithsonian Institution Office of Inspector General, United States of America"
54,"Department of Homeland Security, Under Secretary for National Protection and Programs, United States of America"
57,"Office of the Director of National Intelligence, United States of America"
58,"United States Agency for International Development, United States of America"
59,"Department of Justice, Office of Information Policy, United States of America"
60,"Department of Agriculture, United States of America"
61,"US Trade Representative, United States of America"
62,"Department of Transportation, United States of America"
63,"Department of Labor, United States of America"
64,"Department of the Interior, United States of America"
65,"Department of Commerce, United States of America"
66,"Federal Trade Commission, United States of America"
67,"Department of Transportation, Office of the Inspector General, United States of America"
68,"Federal Aviation Administration, United States of America"
69,"U.S. Office of Management and Budget, United States of America"
70,"National Park Service, United States of America"
71,"United States Secret Service, United States of America"
73,"Massachusetts State Lottery, Massachusetts"
74,"Department of Health and Human Services, United States of America"
75,"Environmental Protection Agency, United States of America"
78,"United States Army Audit Agency, United States of America"
79,"National Institute of Standards and Technology, United States of America"
80,"Department of Housing and Urban Development, United States of America"
81,"Office of Ayanna Pressley, Boston, MA"
82,"Suffolk County District Attorney's Office, Suffolk County, MA"
83,"Department of Treasury, United States of America"
85,"Oxford County Sheriff's Office, Maine"
86,"Air Force, United States of America"
88,"Defense Contract Audit Agency, United States of America"
89,"Defense Contract Management Agency, United States of America"
90,"Defense Finance and Accounting Service, United States of America"
91,"Defense Information Systems Agency, United States of America"
92,"Defense Logistics Agency, United States of America"
93,"Defense Security Service, United States of America"
95,"Defense Threat Reduction Agency, United States of America"
96,"Department of Defense, Education Activity, United States of America"
97,"Missile Defense Agency, United States of America"
98,"National Geospatial-Intelligence Agency, United States of America"
99,"National Guard Bureau/JA-FOIA, United States of America"
100,"National Reconnaissance Office, United States of America"
101,"Department of the Navy, Naval Operations, United States of America"
102,"Department of Defense, Office of the Inspector General, United States of America"
103,"TRICARE Management Activity, United States of America"
104,"U.S. Africa Command, United States of America"
105,"U.S. European Command - USEUCOM, United States of America"
106,"USJFCOM, United States of America"
107,"USNORTHCOM - US Northern Command, United States of America"
108,"USPACOM - US Pacific Command, United States of America"
109,"U.S. Special Operations Command - USSOCOM, United States of America"
110,"SOUTHCOM - US Southern Command, United States of America"
111,"US Strategic Command - USSTRATCOM, United States of America"
112,"USTRANSCOM, United States of America"
113,"Defense Technical Information Center, United States of America"
114,"Legal Department, Somerville, MA"
115,"Department of Justice, Criminal Division, United States of America"
116,"Food and Drug Administration, United States of America"
117,"Census Bureau, Boston Regional Office, United States of America"
118,"Massachusetts Bay Transportation Authority (MBTA), Massachusetts"
119,"U.S. Department of Veterans Affairs, United States of America"
120,"Small Business Administration, United States of America"
121,"National Oceanic and Atmospheric Administration, United States of America"
122,"Boston Public Schools, Boston, MA"
123,"State Racing Commission, Massachusetts"
124,"Department of Public Works, Worcester, MA"
125,"Administration and Finance, Worcester, MA"
126,"Boston Redevelopment Authority, Boston, MA"
127,"Boston Housing Authority, Boston, MA"
129,"National Archives and Records Administration, United States of America"
131,"Parole Board, Massachusetts"
132,"NYC Department of Consumer Affairs, New York City, NY"
133,"Immigration and Customs Enforcement, United States of America"
134,"Newton Public Schools, Newton, MA"
135,"Mayor's Office, Newton, MA"
137,"Drug Enforcement Administration, United States of America"
138,"Executive Office of Health and Human Services, Massachusetts"
139,"Human Resources Division, Massachusetts"
141,"Office of the Comptroller, Massachusetts"
142,"Department of Education, Boston Office, United States of America"
143,"Department of Education, Office of Civil Rights, United States of America"
144,"Barnstable County Sheriff's Office, Barnstable County, MA"
146,"Executive Office for Administration and Finance, Massachusetts"
147,"Town Manager, Saugus, MA"
149,"Somerville City Clerk, Somerville, MA"
152,"Centers for Disease Control and Prevention, United States of America"
153,"Cambridge Housing Authority, Cambridge, MA"
154,"Commonwealth Health Insurance Connector Authority, Massachusetts"
155,"Division of Insurance, Massachusetts"
156,"Office of Medicaid, Massachusetts"
159,"Office of Medicaid, Massachusetts"
160,"Massachusetts Technology Collaborative, Massachusetts"
161,"Executive Office of Housing and Economic Development, Massachusetts"
162,"Department of Transportation, Massachusetts"
163,"MassDevelopment, Massachusetts"
164,"MassDevelopment, Massachusetts"
166,"Department of Justice, Disability Rights Division, United States of America"
168,"Department of Justice, United States of America"
169,"Office of Temporary and Disability Assistance, New York"
170,"National Air and Space Intelligence Center, United States of America"
171,"Massachusetts Clean Energy Center, Massachusetts"
173,"Office of Strategic Planning and Community Development, Somerville, MA"
174,"Boston Police Department, Boston, MA"
175,"Department of Revenue, Massachusetts"
176,"Property & Construction Management, Boston, MA"
177,"Department of Transportation, New York"
178,"NYS Department of Civil Service, New York"
179,"Somerville Housing Authority, Somerville, MA"
181,"Office of the State Comptroller, New York"
182,"U.S. Citizenship and Immigration Services, United States of America"
184,"Special Inspector General for Afghanistan Reconstruction, United States of America"
185,"Cambridge Law Department, Cambridge, MA"
186,"Cambridge City Clerk, Cambridge, MA"
187,"Office of National Drug Control Policy, United States of America"
188,"National Cancer Institute, United States of America"
189,"Army, Office of the Chief of Chaplains, United States of America"
190,"Mayor's Office of Media and Entertainment, New York City, NY"
191,"Elections Division (Secretary of State), Massachusetts"
192,"University of Massachusetts, Massachusetts"
193,"University of Massachusetts (Amherst), Massachusetts"
194,"Office of the Governor - New York, New York"
195,"Massachusetts Emergency Management Agency, Massachusetts"
196,"University of Massachusetts School of Law, Massachusetts"
197,"National Labor Relations Board, United States of America"
198,"Broadcasting Board of Governors, United States of America"
199,"Press Office, Boston, MA"
201,"Department of Justice, Office of Professional Responsibility, United States of America"
202,"Social Security Administration, United States of America"
203,"Office of the Attorney General - New York, New York"
204,"Air Force, 25th Air Force, United States of America"
205,"Bureau of Reclamation, Lower Colorado Region, United States of America"
206,"Federal Energy Regulatory Commission, United States of America"
207,"Mayor's Office, Communications, Somerville, MA"
208,"Washington State Criminal Justice Training Commission, Washington"
209,"National Personnel Records Center, United States of America"
210,"Cambridge Police Department, Cambridge, MA"
211,"Washington State Patrol, Washington"
212,"Office of the Governor - Washington, Washington"
213,"Department of Defense, Biometrics Identity Management Agency, United States of America"
214,"Boston Licensing Board, Boston, MA"
215,"Coast Guard, United States of America"
216,"Office of the Parking Clerk, Boston, MA"
217,"U.S. Army, Dugway Proving Ground, United States of America"
219,"City Council, Seattle, WA"
220,"Department of Planning and Development, Seattle, WA"
221,"Federal Housing Finance Agency, United States of America"
222,"Somerville Historic Preservation Commission, Somerville, MA"
223,"Federal Retirement Thrift Investment Board, United States of America"
224,"National Aeronautics and Space Administration, United States of America"
225,"Bureau of Alcohol, Tobacco, Firearms and Explosives, United States of America"
226,"US Army Test and Evaluation Command, United States of America"
227,"Seattle Police Department, Seattle, WA"
228,"Department of Health, Washington"
230,"The Massachusetts Historical Commission, Massachusetts"
231,"Department of Youth Services, Massachusetts"
232,"Department of Natural Resources, Washington"
233,"Parks and Recreation Commission, Washington"
234,"White House, United States of America"
235,"Smithsonian Institution Office of General Counsel, United States of America"
236,"Department of Homeland Security Office of Inspector General, United States of America"
237,"Internal Revenue Service, United States of America"
238,"Federal Law Enforcement Training Center, United States of America"
239,"Department of Health and Human Services, Centers for Medicare & Medicaid Services, United States of America"
240,"Securities and Exchange Commission, United States of America"
241,"Office of the Mayor, Seattle, WA"
242,"U.S. Patent and Trademark Office, United States of America"
245,"Office of Strategic Planning and Community Development Annex, Somerville, MA"
246,"Department of Transportation, Seattle, WA"
247,"Department of Parks and Recreation, Seattle, WA"
248,"Test Agency, United States of America"
249,"Inspectional Services Division, Building Permits, Somerville, MA"
251,"Mayor's Office of Contract Services, New York City, NY"
253,"Health and  Human Services Department, Newton, MA"
254,"Saugus Public Library, Saugus, MA"
255,"Health Department, Wellesley, MA"
257,"Massachusetts Department of Criminal Justice Information Services, Massachusetts"
258,"Wellesley School Department, Wellesley, MA"
259,"Health Department, Wellesley, MA"
260,"Council of the Inspectors General on Integrity and Efficiency, United States of America"
261,"Railroad Retirement Board, United States of America"
263,"City Clerk, Bullhead City, AZ"
265,"Los Angeles Police Department, Los Angeles, CA"
267,"Division of Health Care Finance and Policy, Massachusetts"
268,"Library of Congress, United States of America"
269,"U.S. Census Bureau, United States of America"
270,"Mayor's Office, Washington (D.C), DC"
271,"Defense Advanced Research Projects Agency — DARPA, United States of America"
272,"New York City Police Department, New York City, NY"
273,"NYC Department of Transportation, New York City, NY"
274,"Massachusetts State Police, Massachusetts"
275,"Board of Appeals, Boston, MA"
276,"Metropolitan Transportation Authority (MTA), Headquarters, New York"
277,"City Clerk, Phoenix, AZ"
278,"Office of the Governor - Arizona, Arizona"
279,"University of Arizona, Arizona"
280,"Navy Office of Information - West, United States of America"
281,"Arizona State University, Arizona"
282,"City of Benson, Benson, AZ"
283,"Kentucky National Guard, United States of America"
284,"Federal Emergency Management Agency, United States of America"
285,"Town Manager, Cohasset, MA"
287,"Office of Government Information Services, United States of America"
288,"USDA Farm Services Agency, United States of America"
289,"Department of Public Health, King County, WA"
290,"Judicial Branch, Connecticut"
291,"Parking Administration, San Diego, CA"
292,"Police Department, Oakland, CA"
293,"Office of the Governor - California, California"
294,"Mayor's Office, Los Angeles, CA"
295,"Department of Justice, California"
297,"Mayor's Office, Hartford, CT"
298,"Mayor's Office, New Haven, CT"
299,"Mayor's Office, Bridgeport, CT"
300,"Mayor's Office, Danbury, CT"
301,"Mayor's Office, New London, CT"
303,"Mayor's Office, Miami, FL"
304,"City Manager's Office, Fort Lauderdale, FL"
305,"New Hampshire State Police, New Hampshire"
306,"United States Army Recruiting Command, United States of America"
307,"Framingham Police Department, Framingham, MA"
308,"Office of the City Manager, Worcester, MA"
309,"Boston Animal Control, Boston, MA"
310,"Department of Correction, Massachusetts"
312,"Department of Education, Arizona"
313,"Department of Motor Vehicles, Washington (D.C), DC"
314,"Public Works, Providence, RI"
315,"Criminal Records, New York"
316,"New York State Office of Court Administration, New York"
317,"Providence Police Department, Providence, RI"
318,"Rhode Island State Police, Rhode Island"
321,"United States Military Academy, United States of America"
323,"Health Department, Somerville, MA"
324,"Secretary of State, Arizona"
325,"Santa Barbara City Attorney,  Santa Barbara, CA"
326,"City Administrator,  Santa Barbara, CA"
327,"Consumer Products Safety Commission, United States of America"
328,"INTERPOL Washington (U.S. National Central Bureau), United States of America"
330,"Supervisor of Records, Massachusetts"
331,"Department of Public Safety, Architectural Access Board, Massachusetts"
332,"Office of Consumer Affairs and Business Regulation	Massachusetts, Consumer Assistance Unit, Massachusetts"
333,"Arlington Police Department, Arlington, TX"
334,"Department of Forestry & Fire Protection (CAL FIRE), California"
335,"Herington City Manager, Herington, KS"
336,"Police Department, Houston, TX"
338,"Police Department, North Little Rock, AR"
339,"Ypsilanti Police Department, Ypsilanti, MI"
342,"Sheriff Department, Santa Clarita, CA"
343,"Ventura County Sheriff's Department, Ventura County, CA"
344,"Wichita Police Department, Wichita, KS"
345,"Ventura Police Department, Ventura County, CA"
346,"Manchester Center Police Department, Manchester Center, VT"
347,"Oxnard Police Department, Oxnard, CA"
349,"University of Central Florida Police Department, Orlando, FL"
350,"Los Angeles County Sheriff's Department, Los Angeles County, CA"
351,"Maine Air National Guard Base, Maine"
353,"Lewis County Sheriff's Department, Lewis County, WA"
354,"New York State Police, New York"
356,"Arvada Police Department, Arvada, CO"
357,"Pittsburgh Bureau of Police, Pittsburgh, PA"
358,"Carnegie Police Department, Carnegie, PA"
359,"South Fayette Township Police Department, South Fayette Township, PA"
360,"Bridgeville Police Department, Bridgeville, PA"
361,"Virginia Beach Police Department, Virginia Beach, VA"
362,"Heidelberg Police Department, Heidelberg, PA"
363,"Flagler County Sheriff's Office, Flagler County, FL"
364,"Fairfax County Police Department, Fairfax County, VA"
365,"Austin Police Department, Austin, TX"
366,"Tucson Police Department, Tucson, AZ"
367,"San Francisco Police Department, San Francisco, CA"
368,"San Diego Police Department, San Diego County, CA"
369,"Oakland Police Department, Oakland, CA"
370,"Doylestown Township Police Department, Doylestown, PA"
371,"Santa Monica Police Department, Santa Monica, CA"
372,"Virginia State Police, Virginia"
373,"Olympia Police Department, Olympia, WA"
374,"Stafford County Sheriff's Office, Stafford, VA"
375,"Denver Police Department, Denver, CO"
376,"Virginia Commonwealth University, Virginia"
377,"City Council, New York City, NY"
379,"Parks and Recreation Department,  Santa Barbara, CA"
380,"Jefferson Police Department, Jefferson, WI"
381,"Ashland Police Department, Ashland, KY"
382,"Washington Court House Police Department, Washington Court House, OH"
383,"University of Texas, Austin, Texas"
384,"Richmond Police Department, Richmond, VA"
385,"Metropolitan Police Department, Washington (D.C), DC"
386,"Miami Police Department, Miami, FL"
387,"Miami-Dade County Police, Miami-Dade County, FL"
388,"Houston Police Department, Public Affairs, Houston, TX"
389,"California Highway Patrol, California"
391,"Charlotte-Mecklenburg Police Department, Charlotte, NC"
392,"Howard County Police Department, Ellicott City, MD"
393,"Metropolitan Nashville Police Department, Nashville, TN"
394,"Minnesota State Patrol, Saint Paul, MN"
395,"Helena Police Department, Helena, MT"
396,"Portland Police Bureau, Portland, OR"
397,"Calhoun County Sheriff's Department, Anniston, AL"
398,"Indiana State Police, Indiana"
399,"Department of Energy, Idaho National Laboratory, United States of America"
401,"Department of Energy, National Energy Technology Laboratory, United States of America"
402,"Federal Financial Institutions Examinations Council, United States of America"
404,"Palo Alto Police Department, Palo Alto, CA"
405,"Portland Police Department, Portland, ME"
406,"Boulder Police Department, Boulder, CO"
407,"Salem Police Department, Salem, OR"
408,"Bay Area Urban Area Security Initiative, San Francisco, CA"
409,"Alameda County Sheriff Department, Alameda County, CA"
410,"Registry of Motor Vehicles, Massachusetts"
411,"Commission on Gay, Lesbian, Bisexual & Transgender Youth, Massachusetts"
412,"Department of Children and Families, Massachusetts"
413,"Purdue University, West Lafayette, IN"
414,"Parking Department, Salem, MA"
415,"University of California, San Diego, San Diego, CA"
416,"Saddleback Community College, Mission Viejo, CA"
417,"McAllen Police Department, McAllen, TX"
418,"Syracuse Police Department, Syracuse, NY"
419,"Monroe County Sheriff, Monroe County, FL"
420,"Brevard County Sheriff, Brevard County, FL"
421,"Pima County Sheriff, Pima County, AZ"
422,"Illinois Central College, Peoria, IL"
423,"Illinois State Police, Illinois"
424,"Peoria Police Department, Peoria, IL"
425,"Peoria County Sheriff, Peoria County, IL"
426,"University of Pittsburgh, Pennsylvania"
427,"Pennsylvania State University, Pennsylvania"
428,"Maricopa County Sheriff, Maricopa County, AZ"
429,"Anaheim Police Department, Anaheim, CA"
430,"Anaheim Police Department, Anaheim, CA"
431,"US Army, Office of the Judge Advocate General, United States of America"
432,"Department of Public Safety, Massachusetts"
433,"Office of the Governor - Massachusetts, Massachusetts"
435,"Pennsylvania State Police, Pennsylvania"
436,"The Ohio State University, Ohio"
437,"Goleta, CA Police Department, Goleta, CA"
438,"Keller, TX Police Department, Keller, TX"
439,"Dallas, TX Police Department, Dallas, TX"
440,"Glendora, CA Police Department, Glendora, CA"
441,"Phoenix Police Department, Phoenix, AZ"
442,"Kettering, OH Police Department, Kettering, OH"
443,"Inspector General, Massachusetts"
445,"Snoqualmie Police Department, Snoqualmie, WA"
446,"Lake County Sheriff's Office, Lake County, FL"
447,"Orlando Police Department, Orlando, FL"
448,"Seminole County Sheriff, Seminole County, FL"
449,"Rhode Island Department of Public Safety, Rhode Island"
450,"Okaloosa County Sheriffs Office, Okaloosa County, FL"
451,"University of Florida, Florida"
452,"Commonwealth Fusion Center, Massachusetts"
453,"Executive Office of Public Safety and Security, Massachusetts"
454,"Office of the Pardon Attorney, United States of America"
455,"Alabama Department of Public Safety, Alabama"
456,"Department of Homeland Security, Science and Technology Directorate, United States of America"
457,"U.S. Forest Service, United States of America"
458,"Department of Agriculture, Agricultural Research Service, United States of America"
459,"Department of the Interior, Office of the Secretary, United States of America"
460,"Queen Anne's County Sheriff, Maryland"
461,"Eastern Gateway Community College, Jefferson County, OH"
463,"Gadsden, AL Police Department, Gadsden, AL"
464,"Hays County, TX Office of Emergency Management, Hays County, TX"
465,"Kansas State University, Kansas"
466,"Mesa County, CO Sheriff, Mesa County, CO"
467,"Montgomery County, TX Sheriff, Montgomery County, TX, TX"
468,"Department of Transportation, Washington"
469,"University of Wisconsin, Wisconsin"
470,"Ohio University, Ohio"
471,"University of Connecticut, Connecticut"
472,"University of Colorado Boulder, Colorado"
473,"Otter Tail County Sheriff, Otter Tail County, MN"
474,"Polk County Sheriff, Polk County, FL"
475,"Texas State University, Texas"
476,"Texas A & M Engineering Experiment Station, Texas"
477,"Texas A & M University-Corpus Christi, Texas"
478,"University of Michigan, Michigan"
479,"Amtrak, United States of America"
480,"Massachusetts Port Authority, Massachusetts"
481,"Boston City Council, Boston, MA"
482,"Lane County Sheriff's Office, Lane County, OR"
483,"Vanderblit University, Nashville, TN"
484,"Florida International University, Miami, FL"
485,"University of Akron, Akron, OH"
486,"University at Buffalo, Buffalo, NY"
487,"University of California, Santa Cruz, California"
488,"University of Central Florida, Orlando, FL"
489,"University of Colorado School of Aerospace Engineering Sciences, Boulder, CO"
491,"University of Louisville, Louisville, KY"
493,"University of Maryland Department of Aerospace Engineering, Maryland"
494,"University of Minnesota, Minnesota"
497,"University of South Florida, Florida"
498,"Department of Treasury, Office of Foreign Asset Control, United States of America"
499,"Lancaster City Clerk, Lancaster, CA"
500,"Golden Gate Bridge, Highway and Transportation District, California"
501,"Energy Facilities Siting Board, Massachusetts"
502,"U.S. Army Criminal Investigation Command, United States of America"
503,"Chicago Police Department, Chicago, IL"
504,"Philadelphia Police Department, Philadelphia, PA"
506,"Virginia Polytechnic Institute and State University, Virginia"
507,"Middlesex County District Attorney's Office, Middlesex County, MA"
508,"Attorney General's Office, Massachusetts"
509,"Bureau of Indian Affairs, United States of America"
511,"Bristol County Sheriff's Office, Bristol County, MA"
512,"Town Administration, Nantucket, MA"
513,"Board of Commissioners, Plymouth County, MA"
514,"Office of the Sheriff, Dukes County, MA"
515,"Norfolk County Sheriff's Office, Norfolk County, MA"
516,"National Center for Complex Operations, Indiana"
517,"Indiana Air National Guard, Indiana"
518,"Naval Sea Systems Command, United States of America"
520,"City Hall, Beverly, MA"
521,"Marlborough Public Schools, Marlborough, MA"
522,"Palmer Town Manager's Office, Palmer, MA"
523,"Taunton Public Schools, Taunton, MA"
524,"Department of Agriculture Office of Inspector General, United States of America"
525,"Washington Island Police Department, Washington Island, WI"
526,"Upper Darby Police Department, Upper Darby, PA"
